{
  "id": "trial_lamp_oil",
  "kind": "trial",
  "trial": "mage",
  "trialLv": 12,
  "title": "Lamp Oil",
  "giver": "pim_rushlight",
  "region": "fens",
  "level": [
    1,
    30
  ],
  "summary": "Pim Rushlight knows what burns, and the lock-keepers' oil stores under the Canal Locks burn better than anything he sells. Hold eight waves there, and he'll show your mages how to keep a fire off somebody (the mage's level-12 skill).",
  "steps": [
    {
      "id": "locks",
      "journal": "Hold eight waves in the Canal Locks, among the lock-keepers' stores. Any floor will do.",
      "objectives": [
        {
          "type": "waves",
          "site": "canal_locks",
          "count": 8,
          "label": "Waves held at the Canal Locks"
        }
      ]
    }
  ],
  "ready": "Go back to Pim Rushlight, at his handcart by Saltmere's cistern.",
  "done": "Pim taught your mages Arcane Ward. He charged nothing, and told you so three times.",
  "rewards": {
    "share": 0.3,
    "lv": 12,
    "gold": 120
  },
  "dialogue": {
    "file": "pim",
    "offer": "pim_lamp_oil_offer",
    "turnin": "pim_lamp_oil_turnin"
  }
}
