{
  "id": "trial_dead_water",
  "kind": "trial",
  "trial": "rogue",
  "trialLv": 12,
  "title": "Dead Water",
  "giver": "wren",
  "region": "fens",
  "level": [
    1,
    30
  ],
  "companion": "wren",
  "summary": "Wren says the harvesters' leaders at the vats never look behind them, because nothing down there ever has. Get behind five, and she'll teach your rogues what she puts on her knives (the rogue's level-12 skill).",
  "steps": [
    {
      "id": "vats",
      "journal": "Defeat five of the Canal Locks' wave-leaders. At Vat Seven, the third floor, they're the harvesters'.",
      "objectives": [
        {
          "type": "elites",
          "site": "canal_locks",
          "count": 5,
          "label": "Wave-leaders at the Locks"
        }
      ]
    }
  ],
  "ready": "Tell Wren it's done: tap her party card, then Talk.",
  "done": "Wren taught your rogues Venom, and wouldn't say where she learned it.",
  "rewards": {
    "share": 0.3,
    "lv": 12,
    "gold": 120
  },
  "dialogue": {
    "file": "wren",
    "offer": "wren_dead_water_offer",
    "turnin": "wren_dead_water_turnin"
  }
}
