{
  "id": "wren_night_boats",
  "kind": "companion",
  "title": "Night Boats",
  "giver": "wren",
  "region": "fens",
  "level": [
    1,
    30
  ],
  "companion": "wren",
  "after": [
    "wren_the_marker"
  ],
  "summary": "Wren hid two caches down at the vats under the Canal Locks, back when she ran the canal at night. The Cult has started drying the vats out, and she'd like them back before it finds them.",
  "steps": [
    {
      "id": "vats",
      "journal": "Open two chests at Vat Seven, the Canal Locks' third floor. Wren says they're hers, and you'll know them by the knots.",
      "objectives": [
        {
          "type": "loot",
          "site": "canal_locks",
          "count": 2,
          "floor": 3,
          "label": "Wren's caches"
        }
      ]
    }
  ],
  "ready": "Tell Wren it's done: tap her party card, then Talk.",
  "done": "You found both of Wren's caches. She counted them in front of you, which she says is a compliment.",
  "rewards": {
    "share": 0.3,
    "lv": 15,
    "gold": 180
  },
  "dialogue": {
    "file": "wren",
    "offer": "wren_boats_offer",
    "turnin": "wren_boats_turnin"
  }
}
