{
  "id": "brannoc_old_debts",
  "kind": "companion",
  "title": "Old Debts",
  "giver": "brannoc",
  "region": "vale",
  "level": [
    1,
    30
  ],
  "companion": "brannoc",
  "summary": "Brannoc, the Redhand deserter you freed in Wickham Keep, says Garrow's sergeants think he owes them. He owes them nothing, and he'd like that settled before it follows him out of the Keep.",
  "steps": [
    {
      "id": "keep",
      "journal": "Defeat three Redhand sergeants in Wickham Keep. They are the Redhand's elites and lead every fifth wave; Brannoc knows them by their shouting.",
      "objectives": [
        {
          "type": "elites",
          "site": "wickham_keep",
          "count": 3,
          "label": "Redhand sergeants"
        }
      ]
    }
  ],
  "ready": "Tell Brannoc it's done: tap his party card, then Talk.",
  "done": "You defeated the three sergeants who kept Brannoc's chain oiled. He said nothing, and stood up straighter.",
  "rewards": {
    "share": 0.35,
    "lv": 6,
    "gold": 90
  },
  "dialogue": {
    "file": "brannoc",
    "offer": "brannoc_debts_offer",
    "turnin": "brannoc_debts_turnin"
  }
}
