{
  "id": "brannoc_paymasters_box",
  "kind": "companion",
  "title": "The Paymaster's Box",
  "giver": "brannoc",
  "region": "vale",
  "level": [
    1,
    30
  ],
  "companion": "brannoc",
  "after": [
    "brannoc_old_debts"
  ],
  "summary": "Brannoc says the Redhand's paymaster kept the robed strangers' coin in Wickham Keep's strongroom, in two boxes, because he trusted nobody, himself included. Brannoc wants to see whose seal is on the purses.",
  "steps": [
    {
      "id": "strongroom",
      "journal": "Open two chests in the Barracks, Wickham Keep's second floor, where the paymaster kept his strongroom.",
      "objectives": [
        {
          "type": "loot",
          "site": "wickham_keep",
          "count": 2,
          "floor": 2,
          "label": "The paymaster's chests"
        }
      ]
    }
  ],
  "ready": "Tell Brannoc it's done: tap his party card, then Talk.",
  "done": "The paymaster's boxes in the Keep's strongroom: coal-red wax on every purse, no crest. Brannoc kept one seal.",
  "rewards": {
    "share": 0.3,
    "lv": 6,
    "gold": 120
  },
  "dialogue": {
    "file": "brannoc",
    "offer": "brannoc_box_offer",
    "turnin": "brannoc_box_turnin"
  }
}
