{
  "id": "wren_settled",
  "kind": "companion",
  "title": "Settled",
  "giver": "wren",
  "region": "fens",
  "level": [
    1,
    30
  ],
  "companion": "wren",
  "after": [
    "wren_night_boats",
    "ch2_the_bells"
  ],
  "summary": "The Cult's boat ties up under the Drowned Abbey. Wren would like to burn it, and needs someone to hold the door while she does.",
  "steps": [
    {
      "id": "abbey",
      "journal": "Hold the Drowned Abbey's first-floor hall for five waves while Wren sees to the boat.",
      "objectives": [
        {
          "type": "waves",
          "site": "drowned_abbey",
          "count": 5,
          "hall": true,
          "floor": 1,
          "label": "Waves held in the Abbey's first hall"
        }
      ]
    }
  ],
  "ready": "Tell Wren it's done: tap her party card, then Talk.",
  "done": "The Cult's boat burned to the waterline while you held the hall. Wren gave you the ring she'd paid her debt with.",
  "rewards": {
    "share": 0.45,
    "lv": 16,
    "gold": 200,
    "item": "the_receipt"
  },
  "dialogue": {
    "file": "wren",
    "offer": "wren_settled_offer",
    "turnin": "wren_settled_turnin"
  }
}
