{
  "id": "ch1_ember_in_the_fist",
  "kind": "chapter",
  "title": "An Ember in the Fist",
  "giver": "osric_hale",
  "turnin": "sister_ilse",
  "region": "vale",
  "level": [
    7,
    30
  ],
  "after": [
    "ch1_the_diggers"
  ],
  "summary": "Captain Garrow's ledger says robed strangers paid him forty crowns to dig at the Sunken Chapel. Osric Hale wants to know who is paying, and what anyone could want from a chapel the river has half eaten.",
  "steps": [
    {
      "id": "chapel",
      "journal": "Go down to the second floor of the Sunken Chapel, in the marsh past the lumber camp. Find the robed stranger who pays for the digging, and stop him.",
      "objectives": [
        {
          "type": "boss",
          "site": "sunken_chapel",
          "boss": "robed_stranger",
          "count": 1,
          "label": "The Robed Stranger"
        }
      ]
    }
  ],
  "ready": "The robed stranger died holding something warm. Take it to Sister Ilse at the Shrine of the Ember in Thornwick.",
  "done": "Sister Ilse has the warm shard from the Sunken Chapel: fens work, cut out of something that was a man.",
  "rewards": {
    "share": 0.55,
    "lv": 8,
    "gold": 200
  },
  "dialogue": {
    "file": "osric",
    "offer": "osric_ch3_offer",
    "turnin": "ilse_ch3_turnin"
  }
}
