{
  "id": "brannoc_standing_down",
  "kind": "companion",
  "title": "Standing Down",
  "giver": "brannoc",
  "region": "vale",
  "level": [
    1,
    30
  ],
  "companion": "brannoc",
  "after": [
    "brannoc_paymasters_box"
  ],
  "summary": "Brannoc has heard of the Third Legion, bound where it stood under the Sunken Chapel, that never deserted anything because nobody told it to stop. He'd like to stand with it once, the way he never stood with anyone.",
  "steps": [
    {
      "id": "crypt",
      "journal": "Go down to the Binding Crypt, the Sunken Chapel's third floor, where the bound stand in rows, and hold five waves there with Brannoc.",
      "objectives": [
        {
          "type": "waves",
          "site": "sunken_chapel",
          "count": 5,
          "floor": 3,
          "label": "Waves held in the Binding Crypt"
        }
      ]
    }
  ],
  "ready": "Tell Brannoc it's done: tap his party card, then Talk.",
  "done": "You held the Binding Crypt with Brannoc among the bound. He stood; they stood. He gave you his old chain, less one link.",
  "rewards": {
    "share": 0.45,
    "lv": 9,
    "gold": 100,
    "item": "broken_chain"
  },
  "dialogue": {
    "file": "brannoc",
    "offer": "brannoc_standing_offer",
    "turnin": "brannoc_standing_turnin"
  }
}
