{
  "id": "trial_cold_weather",
  "kind": "trial",
  "trial": "mage",
  "title": "Cold Weather",
  "giver": "hedda",
  "region": "vale",
  "level": [
    1,
    30
  ],
  "summary": "Hedda sells eggs by Thornwick's well and says the weather listens to her. If your company holds out somewhere damp and cold, she'll teach your mages to call the frost (the mage's level-6 skill).",
  "steps": [
    {
      "id": "chapel",
      "journal": "Hold six waves in the Sunken Chapel, in the marsh where the river leaves the Vale, out past the lumber camp.",
      "objectives": [
        {
          "type": "waves",
          "site": "sunken_chapel",
          "count": 6,
          "label": "Waves held in the Sunken Chapel"
        }
      ]
    }
  ],
  "ready": "Go back to Hedda, by the well in Thornwick.",
  "done": "Hedda taught your mages Frost Nova, and said it was only a hard frost, early. She said it about eggs, too.",
  "rewards": {
    "share": 0.3, "lv": 6,
    "gold": 60
  },
  "dialogue": {
    "file": "townsfolk",
    "offer": "hedda_trial_offer",
    "turnin": "hedda_trial_turnin"
  }
}
