{
  "id": "ch1_the_diggers",
  "kind": "chapter",
  "title": "The Diggers",
  "giver": "osric_hale",
  "region": "vale",
  "level": [
    4,
    30
  ],
  "after": [
    "ch1_smoke_over_the_vale"
  ],
  "summary": "The Redhand you drove out of the Old Barrows went back to Wickham Keep, under a Captain Garrow. Osric Hale has heard they are digging under its cellars. Bandits don't dig, so somebody must be paying them to.",
  "steps": [
    {
      "id": "keep",
      "journal": "Go to Wickham Keep, on the Wickham road north of the crossroads, and go down to its third floor, the Old Cellars, where the digging is.",
      "objectives": [
        {
          "type": "reach",
          "site": "wickham_keep",
          "count": 3,
          "label": "Down to the Old Cellars"
        }
      ]
    },
    {
      "id": "captain",
      "journal": "Captain Garrow holds the last hall of the Old Cellars. Defeat him; his men come when he shouts.",
      "objectives": [
        {
          "type": "boss",
          "site": "wickham_keep",
          "boss": "redhand_captain",
          "count": 1,
          "label": "Captain Garrow"
        }
      ]
    }
  ],
  "ready": "Go back to Osric Hale at the Watch post by Thornwick's well. Garrow kept a ledger; Osric will want it.",
  "done": "You defeated Captain Garrow in Wickham Keep. His ledger says robed strangers paid him to dig at the Sunken Chapel.",
  "rewards": {
    "share": 0.45,
    "lv": 6,
    "gold": 150
  },
  "dialogue": {
    "file": "osric",
    "offer": "osric_ch2_offer",
    "turnin": "osric_ch2_turnin"
  }
}
