{
  "id": "trial_vigil",
  "kind": "trial",
  "trial": "cleric",
  "trialLv": 12,
  "title": "Vigil",
  "giver": "mother_agnes",
  "region": "fens",
  "level": [
    1,
    30
  ],
  "summary": "Mother Agnes says a vigil is a night you stay awake for somebody who can't. The Toadking's island was the fen-folk's burying-ground, and nobody said anything over its drowned. Keep six waves there (the cleric's level-12 skill).",
  "steps": [
    {
      "id": "mound",
      "journal": "Keep a vigil on the Toadking's island: hold six waves on its third floor, its old burying-ground.",
      "objectives": [
        {
          "type": "waves",
          "site": "toadking_mound",
          "count": 6,
          "floor": 3,
          "label": "Waves kept on the Mound's third floor"
        }
      ]
    }
  ],
  "ready": "Go back to Mother Agnes at the Grey Sisters' chapel in Saltmere.",
  "done": "Mother Agnes taught your clerics Turn Undead, and said a prayer for the dead you'll use it on.",
  "rewards": {
    "share": 0.3,
    "lv": 12,
    "gold": 120
  },
  "dialogue": {
    "file": "agnes",
    "offer": "agnes_vigil_offer",
    "turnin": "agnes_vigil_turnin"
  }
}
