{
  "id": "vale_long_way_round",
  "kind": "errand",
  "title": "The Long Way Round",
  "giver": "maudry_fenn",
  "region": "vale",
  "level": [
    1,
    9
  ],
  "summary": "Maudry Fenn keeps the Tired Mule in Thornwick. The carters won't take the barrows road past the walking dead any more, and the long way round goes on the price of everything she pours. She wants the dead in the Old Barrows knocked back.",
  "steps": [
    {
      "id": "barrows",
      "journal": "Go down to the Long Gallery, the Old Barrows' second floor, where the dead lie in their niches. Hold four waves there, and open one of their chests.",
      "objectives": [
        {
          "type": "waves",
          "site": "barrows",
          "count": 4,
          "floor": 2,
          "label": "Waves held in the Long Gallery"
        },
        {
          "type": "loot",
          "site": "barrows",
          "count": 1,
          "label": "Chests opened in the Old Barrows"
        }
      ]
    }
  ],
  "ready": "Go back to Maudry Fenn at the Tired Mule in Thornwick and tell her.",
  "done": "You knocked back the dead in the Long Gallery for Maudry Fenn. The carters complain about something else now.",
  "rewards": {
    "share": 0.25,
    "lv": 2,
    "gold": 40
  },
  "dialogue": {
    "file": "maudry",
    "offer": "maudry_longway_offer",
    "turnin": "maudry_longway_turnin"
  }
}
